{
  "$schema": "https://json-schema.org/draft/2020-12/schema",
  "$id": "https://github.com/sattyamjjain/agent-audit-kit/schema/ox-cve-manifest.schema.json",
  "title": "OX-disclosed CVE coverage manifest",
  "type": "object",
  "required": ["schema_version", "manifest_version", "source", "entries"],
  "properties": {
    "schema_version": {"const": "1"},
    "manifest_version": {"type": "string", "pattern": "^\\d{4}-\\d{2}-\\d{2}$"},
    "source": {"type": "string"},
    "source_url": {"type": "string", "format": "uri"},
    "fetched_at": {"type": "string", "pattern": "^\\d{4}-\\d{2}-\\d{2}$"},
    "license": {"type": "string"},
    "entries": {
      "type": "array",
      "items": {
        "type": "object",
        "required": ["cve", "title", "disclosed", "covered"],
        "properties": {
          "cve": {"type": "string"},
          "title": {"type": "string"},
          "disclosed": {"type": "string", "pattern": "^\\d{4}-\\d{2}-\\d{2}$"},
          "covered": {"type": "boolean"},
          "rules": {
            "type": "array",
            "items": {"type": "string", "pattern": "^AAK-"}
          },
          "notes": {"type": "string"}
        },
        "additionalProperties": false
      }
    }
  },
  "additionalProperties": false
}
