{
  "schema_version": "1",
  "manifest_version": "2026-10-17",
  "source": "OX Security — Mother-of-AI-supply-chains disclosure timeline",
  "source_url": "https://www.ox.security/blog/mother-of-ai-supply-chains-mcp/",
  "fetched_at": "2026-04-28",
  "license": "CC-BY-4.0",
  "entries": [
    {
      "cve": "OX-MCP-2026-04-15",
      "title": "Upstream MCP SDK STDIO command-injection inheritance",
      "disclosed": "2026-04-15",
      "covered": true,
      "rules": [
        "AAK-ANTHROPIC-SDK-001",
        "AAK-STDIO-001",
        "AAK-MCPWN-001"
      ],
      "notes": "Anthropic declined to CVE — sanitisation is downstream's job."
    },
    {
      "cve": "OX-MCP-2026-04-25",
      "title": "MCP StdioServerParameters config-to-spawn taint",
      "disclosed": "2026-04-25",
      "covered": true,
      "rules": [
        "AAK-MCP-STDIO-CMD-INJ-001",
        "AAK-MCP-STDIO-CMD-INJ-002",
        "AAK-MCP-STDIO-CMD-INJ-003",
        "AAK-MCP-STDIO-CMD-INJ-004",
        "AAK-MCP-MARKETPLACE-CONFIG-FETCH-001"
      ],
      "notes": "Five separate disclosures rolled up into one shape."
    },
    {
      "cve": "CVE-2025-66335",
      "title": "apache-doris-mcp-server SQL injection",
      "disclosed": "2026-04-20",
      "covered": true,
      "rules": ["AAK-DORIS-001"]
    },
    {
      "cve": "CVE-2026-39313",
      "title": "mcp-framework HTTP-body DoS",
      "disclosed": "2026-04-22",
      "covered": true,
      "rules": ["AAK-MCPFRAME-001"]
    },
    {
      "cve": "CVE-2026-23744",
      "title": "MCPJam Inspector vendored fork",
      "disclosed": "2026-04-23",
      "covered": true,
      "rules": ["AAK-MCP-INSPECTOR-CVE-2026-23744-001"]
    },
    {
      "cve": "CVE-2026-27825",
      "title": "Atlassian MCP RCE chain",
      "disclosed": "2026-04-21",
      "covered": true,
      "rules": ["AAK-MCP-ATLASSIAN-CVE-2026-27825-001"]
    },
    {
      "cve": "CVE-2026-20205",
      "title": "splunk-mcp-server token-cleartext logging",
      "disclosed": "2026-04-05",
      "covered": true,
      "rules": ["AAK-SPLUNK-TOKLOG-001", "AAK-SPLUNK-MCP-TOKEN-LEAK-001"]
    },
    {
      "cve": "CVE-2025-66414",
      "title": "MCP Python SDK StreamableHTTP DNS rebinding",
      "disclosed": "2026-04-10",
      "covered": true,
      "rules": ["AAK-DNS-REBIND-001", "AAK-DNS-REBIND-002"]
    },
    {
      "cve": "CVE-2025-66416",
      "title": "MCP Python SDK StreamableHTTP DNS rebinding (companion)",
      "disclosed": "2026-04-10",
      "covered": true,
      "rules": ["AAK-DNS-REBIND-001", "AAK-DNS-REBIND-002"]
    },
    {
      "cve": "CVE-2026-35568",
      "title": "MCP Java SDK StreamableHTTP DNS rebinding",
      "disclosed": "2026-04-10",
      "covered": true,
      "rules": ["AAK-DNS-REBIND-001", "AAK-DNS-REBIND-002"]
    },
    {
      "cve": "CVE-2026-35577",
      "title": "Apollo MCP server StreamableHTTP DNS rebinding",
      "disclosed": "2026-04-10",
      "covered": true,
      "rules": ["AAK-DNS-REBIND-001", "AAK-DNS-REBIND-002"]
    },
    {
      "cve": "CVE-2026-40576",
      "title": "excel-mcp-server path traversal",
      "disclosed": "2026-04-18",
      "covered": true,
      "rules": ["AAK-EXCEL-MCP-001"]
    },
    {
      "cve": "CVE-2026-40608",
      "title": "next-ai-draw-io body-accumulation DoS",
      "disclosed": "2026-04-18",
      "covered": true,
      "rules": ["AAK-NEXT-AI-DRAW-001"]
    },
    {
      "cve": "CVE-2026-41481",
      "title": "langchain-text-splitters validate-then-fetch SSRF",
      "disclosed": "2026-04-19",
      "covered": true,
      "rules": ["AAK-LANGCHAIN-SSRF-REDIR-001"]
    },
    {
      "cve": "CVE-2026-41488",
      "title": "validate-then-fetch DNS-rebind / TOCTOU SSRF",
      "disclosed": "2026-04-19",
      "covered": true,
      "rules": ["AAK-SSRF-TOCTOU-001"]
    },
    {
      "cve": "CVE-2026-32211",
      "title": "Azure MCP server-author missing auth",
      "disclosed": "2026-04-12",
      "covered": true,
      "rules": ["AAK-AZURE-MCP-NOAUTH-001"]
    },
    {
      "cve": "CVE-2026-33032",
      "title": "MCPwn twin-route middleware asymmetry",
      "disclosed": "2026-04-08",
      "covered": true,
      "rules": ["AAK-MCPWN-001"]
    },
    {
      "cve": "CVE-2026-35402",
      "title": "mcp-neo4j-cypher Cypher-injection",
      "disclosed": "2026-04-09",
      "covered": true,
      "rules": ["AAK-NEO4J-001"]
    },
    {
      "cve": "CVE-2026-6494",
      "title": "MCP tool log-injection",
      "disclosed": "2026-04-07",
      "covered": true,
      "rules": ["AAK-LOGINJ-001"]
    }
  ]
}
